<?xml version="1.0" encoding="utf-8" standalone="no"?>
<!DOCTYPE MetaData SYSTEM "../../../sysdata/dtd/MetaFile.dtd">
<MetaData>
  <ManagedObject>
<ParentBasicInfo MoTypeId="500012" MoTypeType="APPS" ParentMoType="1" EndUserReportable="N" UniqueName="1WMIVam" GUIDisplayName="WMIVam Info" OneInstancePerParent="Y" EndUserCreatable="Y" GUIDisplayable="Y" EndUserDeletable="Y" IsAutoCreated="N" HasCustomizedGUI="N"/>
<ParentAppsInfo ClassName="com.proactivenet.monitors.WMIVam.WMIVam" HasMoreInfo="N" OS="Windows" IsStatic="Y" IsNewFrameWork="Y" IsSchedulable="N" Version="1.0" OSName="Any" GUIMonitorGroup="OTHER" VendorName="ProactiveNet Inc." BuildDescription="This_Is_A_Sample_Build_Description" MinVersion="4.1.2" MinBuild="32" MustRunOnAgent="N" SupportFlashCheck="Y" HasArrayAttribute="N" IsGroupResourcePool="N" IsIndexMon="N" AutoDiscoveryEnabled="N"/>
<BasicInfo HasCustomizedGUI="Y" MoTypeId="500013" MoTypeType="APPS" ParentMoType="500012" UniqueName="WMIVam" GUIDisplayName="Windows Management Instrumentation" EndUserCreatable="Y" GUIDisplayable="Y" EndUserDeletable="Y" IsAutoCreated="N" OneInstancePerParent="N" EndUserReportable="Y"/>
<AppsInfo ClassName="com.proactivenet.monitors.WMIVam.WMIVam" HasMoreInfo="N" OS="Windows" Version="1.0" OSName="Any" GUIMonitorGroup="OTHER" VendorName="ProactiveNet Inc." BuildDescription="This_Is_A_Sample_Build_Description" MinVersion="4.1.2" MinBuild="32" IsSchedulable="Y" MustRunOnAgent="N" IsStatic="N" IsNewFrameWork="N" SupportFlashCheck="Y" HasArrayAttribute="N" IsGroupResourcePool="N" IsIndexMon="N" AutoDiscoveryEnabled="N"/>
</ManagedObject>

  <Attributes>
<Application>
<ParentAppsInput AttrId="500012999" UsrAttrId="999" UniqueName="INSTANCE_NAME" GUIDisplayName="Instance Name" GUIInputType="CFG" ScaleFactor="1000" IsDefaultValueSet="Y" DisplayType="String" UseAsMODisplayName="Y" DefaultValue="WMIVam" GUIStringLength="0" MoReferenceType="0" AttrReferenceType="ANY" GUIDisplaySequenceNumber="0" IsAutoCreated="Y" GUIRequiredOnCreate="Y" GUIEditable="Y" GUIDisplayable="Y" GUIInputOnCreate="Y" UseAsInstanceName="N" IsInputAttribute="Y" GUIHasListOfChoice="N" UseNormalDistribution="N"/>
<AppsInput AttrId="500013003" UsrAttrId="3" UniqueName="OBJECT" GUIDisplayName="Class" GUIInputType="CFG" ScaleFactor="1000" GUIDisplaySequenceNumber="51" UseAsInstanceName="Y" IsDefaultValueSet="Y" DisplayType="String" GUIHasListOfChoice="Y" GUIStringLength="0" MoReferenceType="0" AttrReferenceType="ANY" IsAutoCreated="Y" GUIRequiredOnCreate="Y" GUIEditable="Y" UseAsMODisplayName="N" GUIDisplayable="Y" GUIInputOnCreate="Y" IsInputAttribute="Y" DefaultValue="" UseNormalDistribution="N"/>
<AppsInput AttrId="500013004" UsrAttrId="4" UniqueName="INSTANCE" GUIDisplayName="Instance" GUIInputType="CFG" ScaleFactor="1000" GUIDisplaySequenceNumber="52" UseAsInstanceName="Y" IsDefaultValueSet="Y" GUIRequiredOnCreate="N" DisplayType="String" GUIHasListOfChoice="Y" GUIStringLength="0" MoReferenceType="0" AttrReferenceType="ANY" IsAutoCreated="Y" GUIEditable="Y" UseAsMODisplayName="N" GUIDisplayable="Y" GUIInputOnCreate="Y" IsInputAttribute="Y" DefaultValue="" UseNormalDistribution="N"/>
<AppsInput AttrId="500013005" UsrAttrId="5" UniqueName="PROPERTY" GUIDisplayName="Properties" GUIInputType="CFG" ScaleFactor="1000" GUIDisplaySequenceNumber="53" UseAsInstanceName="Y" IsDefaultValueSet="Y" DisplayType="String" GUIHasListOfChoice="Y" GUIStringLength="0" MoReferenceType="0" AttrReferenceType="ANY" IsAutoCreated="Y" GUIRequiredOnCreate="Y" GUIEditable="Y" UseAsMODisplayName="N" GUIDisplayable="Y" GUIInputOnCreate="Y" IsInputAttribute="Y" DefaultValue="" UseNormalDistribution="N"/>
<AppsInput AttrId="500013006" UsrAttrId="6" UniqueName="TEST" GUIDisplayName="Test" GUIInputType="CFG" ScaleFactor="1000" GUIDisplaySequenceNumber="52" UseAsInstanceName="Y" IsDefaultValueSet="Y" GUIRequiredOnCreate="N" DisplayType="String" GUIStringLength="0" MoReferenceType="0" AttrReferenceType="ANY" IsAutoCreated="Y" GUIEditable="Y" UseAsMODisplayName="N" GUIDisplayable="Y" GUIInputOnCreate="Y" IsInputAttribute="Y" GUIHasListOfChoice="N" DefaultValue="" UseNormalDistribution="N"/>
</Application>
</Attributes>
</MetaData>
