<?xml version="1.0" encoding="UTF-8"?>
<!DOCTYPE MetaData SYSTEM "../../../pronto/sysdata/dtd/MetaFile.dtd">
<!-- Level 4 -->

<MetaData>
  <ManagedObject>
    <ParentBasicInfo MoTypeId="48060" MoTypeType="APPS" ParentMoType="1" EndUserReportable="N" UniqueName="PATROL_VSM_CNTR" GUIDisplayName="Patrol VSM Container" OneInstancePerParent="Y"/>
    <ParentAppsInfo ClassName="com.proactivenet.monitors.PatrolVSAdapter.PatrolVSPollManager" IsAdapterFrameWork="Y" IsStatic="Y" SupportFlashCheck="N" IsNewFrameWork="Y" IsSchedulable="N"/>
    <BasicInfo MoTypeId="48061" MoTypeType="APPS" ParentMoType="48060" UniqueName="VSM_CNTR" GUIDisplayName="VSM"/>
    <AppsInfo ClassName="com.proactivenet.monitors.PatrolVSAdapter.PatrolVSPollManager" IsAutoSyncEnabled="Y" IsAdapterFrameWork="Y" IsStatic="Y" SupportFlashCheck="N" AdapterType="60008" IsNewFrameWork="Y"/>
  </ManagedObject>
  <Attributes>
    <Application>
      <ParentAppsInput AttrId="48060999" UsrAttrId="999" UniqueName="INSTANCE_NAME" GUIDisplayName="Instance Name" GUIInputType="CFG" ScaleFactor="1000" IsDefaultValueSet="Y" AttrReferenceType="Unknown" IsInputAttribute="Y" DisplayType="String" UseAsMODisplayName="Y" DefaultValue="VSM_CNTR"/>
      <AppsInput AttrId="48061011" UsrAttrId="11" UniqueName="APP_INSTANCE_NAME" GUIDisplayName="App Instance Name" GUIEditable="N" GUIInputType="CFG" ScaleFactor="1000" GUIDisplayable="N" IsDefaultValueSet="Y" AttrReferenceType="Unknown" IsAutoDiscoverable="Y" GUIRequiredOnCreate="N" IsInputAttribute="Y" DisplayType="String"/>
      <AppsInput AttrId="48061999" UsrAttrId="999" UniqueName="INSTANCE_NAME" GUIDisplayName="Instance Name" GUIEditable="N" GUIInputType="CFG" ScaleFactor="1000" GUIDisplaySequenceNumber="1" IsDefaultValueSet="Y" GUIInputOnCreate="N" AttrReferenceType="Unknown" GUIRequiredOnCreate="N" IsInputAttribute="Y" DisplayType="String" UseAsMODisplayName="Y" DefaultValue=""/>
      <AppsInput AttrId="48061008" UsrAttrId="8" UniqueName="USERNAME" GUIDisplayName="User Name" GUIEditable="N" GUIInputType="CFG" ScaleFactor="1000" GUIDisplaySequenceNumber="5" IsDefaultValueSet="Y" AttrReferenceType="Unknown" IsInputAttribute="Y" DisplayType="String" DefaultValue="admin"/>
      <AppsInput AttrId="48061994" UsrAttrId="994" UniqueName="COLLECTDATA" GUIDisplayName="Collect Data" GUIInputType="CTL" ScaleFactor="1000" IsDefaultValueSet="Y" AttrReferenceType="Unknown" IsInputAttribute="Y" DisplayType="Boolean" DefaultValue="1"/>
      <AppsInput AttrId="48061014" UsrAttrId="14" UniqueName="PARENT_PATH" GUIDisplayName="Parent Path" GUIEditable="N" GUIInputType="CFG" ScaleFactor="1000" GUIDisplayable="N" IsDefaultValueSet="Y" AttrReferenceType="Unknown" IsAutoDiscoverable="Y" GUIRequiredOnCreate="N" IsInputAttribute="Y" DisplayType="String" DefaultValue="/VSM/VSM_VC/VSM_HOST"/>
      <AppsInput AttrId="48061050" UsrAttrId="50" UniqueName="PARENT_ADAPTER" GUIDisplayName="Adapter" GUIEditable="N" GUIInputType="CFG" ScaleFactor="1000" GUIDisplaySequenceNumber="2" IsDefaultValueSet="Y" GUIInputOnCreate="N" AttrReferenceType="Unknown" MoReferenceType="60008" GUIRequiredOnCreate="N" IsInputAttribute="Y" DisplayType="MOReference" DefaultValue="-1"/>
      <AppsInput AttrId="48061998" UsrAttrId="998" UniqueName="STSPOLLPERIOD" GUIDisplayName="Statistics Poll Interval" GUIInputType="CTL" ScaleFactor="1" IsDefaultValueSet="Y" AttrReferenceType="Unknown" IsInputAttribute="Y" DisplayType="Integer" DefaultValue="900"/>
      <AppsInput AttrId="48061001" UsrAttrId="1" UniqueName="PARENT_ID" GUIDisplayName="Parent ID" GUIEditable="N" GUIInputType="CFG" ScaleFactor="1000" GUIDisplayable="N" IsDefaultValueSet="Y" AttrReferenceType="Unknown" GUIRequiredOnCreate="N" IsInputAttribute="Y" DisplayType="Integer" DefaultValue="48077"/>
      <AppsInput AttrId="48061003" UsrAttrId="3" UniqueName="APP_PATH" GUIDisplayName="Application Path" GUIEditable="N" GUIInputType="CFG" ScaleFactor="1000" GUIDisplayable="N" IsDefaultValueSet="Y" AttrReferenceType="Unknown" IsAutoDiscoverable="Y" GUIRequiredOnCreate="N" IsInputAttribute="Y" DisplayType="String"/>
      <AppsInput AttrId="48061004" UsrAttrId="4" UniqueName="DNSIP" GUIDisplayName="PATROL Proxy Agent Hostname/IP" GUIEditable="N" GUIInputType="CFG" ScaleFactor="1000" GUIDisplaySequenceNumber="3" IsDefaultValueSet="Y" AttrReferenceType="Unknown" IsInputAttribute="Y" DisplayType="String"/>
      <AppsInput AttrId="48061007" UsrAttrId="7" UniqueName="SRCIP" GUIDisplayName="Source Agent" GUIEditable="N" GUIInputType="CFG" ScaleFactor="1000" GUIDisplayable="N" GUIDisplaySequenceNumber="2" IsDefaultValueSet="Y" MoReferenceType="10000" IsInputAttribute="Y" DisplayType="MOReference" DefaultValue="-1"/>
      <AppsInput AttrId="48061006" UsrAttrId="6" UniqueName="PASSWORD" GUIDisplayName="Password" GUIInputType="CFG" ScaleFactor="1000" GUIDisplayable="N" GUIDisplaySequenceNumber="6" IsDefaultValueSet="Y" AttrReferenceType="Unknown" IsInputAttribute="Y" DisplayType="Password" DefaultValue="admin"/>
      <AppsInput AttrId="48061009" UsrAttrId="9" UniqueName="PATROL_AGENT_NAME" GUIDisplayName="Patrol Agent" GUIEditable="N" GUIInputType="CFG" ScaleFactor="1000" GUIDisplayable="N" IsDefaultValueSet="Y" AttrReferenceType="Unknown" IsAutoDiscoverable="Y" GUIRequiredOnCreate="N" IsInputAttribute="Y" DisplayType="String"/>
      <AppsInput AttrId="48061010" UsrAttrId="10" UniqueName="APP_DEF_NAME" GUIDisplayName="Application Class Definition Name" GUIEditable="N" GUIInputType="CFG" ScaleFactor="1000" GUIDisplayable="N" IsDefaultValueSet="Y" AttrReferenceType="Unknown" IsAutoDiscoverable="Y" GUIRequiredOnCreate="N" IsInputAttribute="Y" DisplayType="String" DefaultValue="VSM_CNTR"/>
      <AppsInput AttrId="48061005" UsrAttrId="5" UniqueName="PORT" GUIDisplayName="PATROL Proxy Agent Port" GUIEditable="N" GUIInputType="CFG" ScaleFactor="1000" GUIDisplaySequenceNumber="4" IsDefaultValueSet="Y" AttrReferenceType="Unknown" IsInputAttribute="Y" DisplayType="Integer" DefaultValue="3182"/>
      <AppsInput AttrId="48061997" UsrAttrId="997" UniqueName="STSPOLLTIMEOUT" GUIDisplayName="Statistics Poll Timeout" GUIInputType="CTL" ScaleFactor="1" IsDefaultValueSet="Y" AttrReferenceType="Unknown" IsInputAttribute="Y" DisplayType="Integer" DefaultValue="120"/>
      <AppsInput AttrId="48061013" UsrAttrId="13" UniqueName="INST_PATH" GUIDisplayName="Instance Path" GUIEditable="N" GUIInputType="CFG" ScaleFactor="1000" GUIDisplayable="N" IsDefaultValueSet="Y" AttrReferenceType="Unknown" IsAutoDiscoverable="Y" GUIRequiredOnCreate="N" IsInputAttribute="Y" DisplayType="String"/>
      <AppsInput AttrId="48061980" UsrAttrId="980" UniqueName="CI_TOKEN_ID" GUIDisplayName="CI Token ID" GUIInputType="CFG" GUIEditable="N" ScaleFactor="1000" GUIDisplaySequenceNumber="1" IsDefaultValueSet="Y" AttrReferenceType="ANY" GUIRequiredOnCreate="N" IsInputAttribute="Y" DisplayType="String" DefaultValue=""/>
      <AppsInput AttrId="48061981" UsrAttrId="981" UniqueName="CI_ID" GUIDisplayName="CI ID" GUIInputType="CFG" GUIEditable="N" ScaleFactor="1000" GUIDisplaySequenceNumber="2" IsDefaultValueSet="Y" AttrReferenceType="ANY" GUIRequiredOnCreate="N" IsInputAttribute="Y" DisplayType="String" DefaultValue=""/>
      <AppsInput AttrId="48061982" UsrAttrId="982" UniqueName="CI_ALIAS" GUIDisplayName="CI Alias" GUIInputType="CFG" GUIEditable="Y" GUIStringLength="255" ScaleFactor="1000" GUIDisplaySequenceNumber="3" IsDefaultValueSet="Y" AttrReferenceType="ANY" GUIRequiredOnCreate="N" IsInputAttribute="Y" DisplayType="String" DefaultValue=""/>
      <AppsInput AttrId="48061468" UsrAttrId="468" UniqueName="TENANT_ID" GUIDisplayName="Tenant ID" MoReferenceType="0" AttrReferenceType="Unknown" DefaultValue="" ScaleFactor="0" GUIStringLength="255" GUIDisplaySequenceNumber="7" GUIDisplayable="N" DisplayType="String" UseAsMODisplayName="N" GUIInputType="CFG" IsInputAttribute="Y" IsAutoCreated="Y" GUIRequiredOnCreate="N" GUIEditable="N" GUIInputOnCreate="Y" IsDefaultValueSet="N" UseAsInstanceName="N" GUIHasListOfChoice="N" UseNormalDistribution="N"/>
      <AppsStats>
        <CoreAppsStats AttrId="48061200" UsrAttrId="200" UniqueName="PN_DUMMY_STATS" GUIDisplayName="PN Dummy Stats" TableName="VSM_CNTR" ColumnName="PN_DUMMY_STATS" ScaleFactor="1" GUIDisplayable="N" AttrReferenceType="Unknown" DisplayType="Integer" UnitOfMeasurement="#" GUIGraphedByDefault="N"/>
      </AppsStats>
    </Application>
  </Attributes>
</MetaData>
