<?xml version="1.0" encoding="utf-8" standalone="no"?>
<!DOCTYPE MetaData SYSTEM "../../../sysdata/dtd/MetaFile.dtd">
<MetaData>
  <ManagedObject>
<ParentBasicInfo MoTypeId="500006" MoTypeType="APPS" ParentMoType="1" EndUserReportable="N" UniqueName="1vamdatastoremon" GUIDisplayName="vamdatastoremon Info" OneInstancePerParent="Y" EndUserCreatable="Y" GUIDisplayable="Y" EndUserDeletable="Y" IsAutoCreated="N" HasCustomizedGUI="N"/>
<ParentAppsInfo ClassName="com.proactivenet.monitors.vamdatastoremon.vamdatastoremon" HasMoreInfo="N" OS="SunOS:Windows" IsStatic="Y" IsNewFrameWork="Y" IsSchedulable="N" Version="1.0" OSName="Any" GUIMonitorGroup="OTHER" VendorName="ProactiveNet Inc." BuildDescription="This_Is_A_Sample_Build_Description" MinVersion="4.1.2" MinBuild="32" MustRunOnAgent="N" SupportFlashCheck="Y" HasArrayAttribute="N" IsGroupResourcePool="N" IsIndexMon="N" AutoDiscoveryEnabled="N"/>
<BasicInfo HasCustomizedGUI="Y" MoTypeId="500007" MoTypeType="APPS" ParentMoType="500006" UniqueName="vamdatastoremon" GUIDisplayName="VAM Adaptor for Data Store" EndUserCreatable="Y" GUIDisplayable="Y" EndUserDeletable="Y" IsAutoCreated="N" OneInstancePerParent="N" EndUserReportable="Y"/>
<AppsInfo ClassName="com.proactivenet.monitors.vamdatastoremon.vamdatastoremon" HasMoreInfo="N" OS="SunOS:Windows" Version="1.0" OSName="Any" GUIMonitorGroup="OTHER" VendorName="ProactiveNet Inc." BuildDescription="This_Is_A_Sample_Build_Description" MinVersion="4.1.2" MinBuild="32" IsSchedulable="Y" MustRunOnAgent="N" IsStatic="N" IsNewFrameWork="N" SupportFlashCheck="Y" HasArrayAttribute="N" IsGroupResourcePool="N" IsIndexMon="N" AutoDiscoveryEnabled="N"/>
</ManagedObject>

  <Attributes>
<Application>
<ParentAppsInput AttrId="500006999" UsrAttrId="999" UniqueName="Instance Name" GUIDisplayName="Instance Name" GUIInputType="CFG" ScaleFactor="1000" IsDefaultValueSet="Y" DisplayType="String" UseAsMODisplayName="Y" DefaultValue="Adaptor for Data Store" GUIStringLength="0" MoReferenceType="0" AttrReferenceType="ANY" GUIDisplaySequenceNumber="0" IsAutoCreated="Y" GUIRequiredOnCreate="Y" GUIEditable="Y" GUIDisplayable="Y" GUIInputOnCreate="Y" UseAsInstanceName="N" IsInputAttribute="Y" GUIHasListOfChoice="N" UseNormalDistribution="N"/>
<AppsInput AttrId="500007004" UsrAttrId="4" UniqueName="TABLE_NAME" GUIDisplayName="Table Name" GUIInputType="CFG" ScaleFactor="1000" GUIDisplaySequenceNumber="51" UseAsInstanceName="Y" IsDefaultValueSet="Y" GUIRequiredOnCreate="N" DisplayType="String" GUIHasListOfChoice="Y" GUIStringLength="0" MoReferenceType="0" AttrReferenceType="ANY" IsAutoCreated="Y" GUIEditable="Y" UseAsMODisplayName="N" GUIDisplayable="Y" GUIInputOnCreate="Y" IsInputAttribute="Y" DefaultValue="" UseNormalDistribution="N"/>
<AppsInput AttrId="500007005" UsrAttrId="5" UniqueName="COLUMN_NAME" GUIDisplayName="Column Name" GUIInputType="CFG" ScaleFactor="1000" GUIDisplaySequenceNumber="52" UseAsInstanceName="Y" IsDefaultValueSet="Y" DisplayType="String" GUIHasListOfChoice="Y" GUIStringLength="0" MoReferenceType="0" AttrReferenceType="ANY" IsAutoCreated="Y" GUIRequiredOnCreate="Y" GUIEditable="Y" UseAsMODisplayName="N" GUIDisplayable="Y" GUIInputOnCreate="Y" IsInputAttribute="Y" DefaultValue="" UseNormalDistribution="N"/>
<AppsInput AttrId="500007006" UsrAttrId="6" UniqueName="VALIDATE" GUIDisplayName="VALIDATE" GUIInputType="CFG" ScaleFactor="1000" GUIDisplayable="N" GUIDisplaySequenceNumber="53" IsDefaultValueSet="Y" DisplayType="String" GUIStringLength="0" MoReferenceType="0" AttrReferenceType="ANY" IsAutoCreated="Y" GUIRequiredOnCreate="Y" GUIEditable="Y" UseAsMODisplayName="N" GUIInputOnCreate="Y" UseAsInstanceName="N" IsInputAttribute="Y" GUIHasListOfChoice="N" DefaultValue="" UseNormalDistribution="N"/>
<AppsInput AttrId="500007015" UsrAttrId="15" UniqueName="VALIDATE_COLUMN" GUIDisplayName="Table Name" GUIInputType="CFG" ScaleFactor="1000" GUIDisplaySequenceNumber="51" UseAsInstanceName="Y" IsDefaultValueSet="Y" GUIRequiredOnCreate="N" DisplayType="String" GUIHasListOfChoice="Y" GUIStringLength="0" MoReferenceType="0" AttrReferenceType="ANY" IsAutoCreated="Y" GUIEditable="Y" UseAsMODisplayName="N" GUIDisplayable="Y" GUIInputOnCreate="Y" IsInputAttribute="Y" DefaultValue="" UseNormalDistribution="N"/>
<AppsInput AttrId="705102716" UsrAttrId="12" UniqueName="WHERE_CLAUSE" GUIDisplayName="Where clause" GUIInputType="CFG" ScaleFactor="1000" GUIDisplaySequenceNumber="53" UseAsInstanceName="Y" IsDefaultValueSet="Y" DisplayType="String" GUIHasListOfChoice="Y" GUIStringLength="0" MoReferenceType="0" AttrReferenceType="ANY" IsAutoCreated="Y" GUIRequiredOnCreate="Y" GUIEditable="Y" UseAsMODisplayName="N" GUIDisplayable="Y" GUIInputOnCreate="Y" IsInputAttribute="Y" DefaultValue="" UseNormalDistribution="N"/>
<AppsInput AttrId="500007016" UsrAttrId="16" UniqueName="COLNAMES" GUIDisplayName="Column Names" GUIInputType="CFG" ScaleFactor="1000" GUIDisplayable="N" GUIDisplaySequenceNumber="55" IsDefaultValueSet="Y" DisplayType="String" GUIStringLength="0" MoReferenceType="0" AttrReferenceType="ANY" IsAutoCreated="Y" GUIRequiredOnCreate="Y" GUIEditable="Y" UseAsMODisplayName="N" GUIInputOnCreate="Y" UseAsInstanceName="N" IsInputAttribute="Y" GUIHasListOfChoice="N" DefaultValue="" UseNormalDistribution="N"/>
</Application>
</Attributes>
</MetaData>
