<?xml version="1.0" encoding="UTF-8"?>
<!DOCTYPE MetaData SYSTEM "../../../pronto/sysdata/dtd/MetaFile.dtd">
<!-- NTDiskSpaceMeta.xml -->

<MetaData>
  <ManagedObject>
    <ParentBasicInfo MoTypeId="21012" MoTypeType="APPS" ParentMoType="1" EndUserReportable="N" UniqueName="NTDiskInfo" GUIDisplayName="NT Disk Space Monitor" OneInstancePerParent="Y"/>
    <ParentAppsInfo ClassName="ntdiskmon" Version="2.0" OS="Windows" IsStatic="Y" IsSchedulable="N"/>
    <BasicInfo MoTypeId="21013" MoTypeType="APPS" ParentMoType="21012" UniqueName="NTDiskSpace" GUIDisplayName="Windows File System"/>
    <AppsInfo ClassName="ntdiskmon" Version="2.0" OS="Windows"/>
  </ManagedObject>
  <Attributes>
    <Application>
      <ParentAppsInput AttrId="210130" UsrAttrId="1" UniqueName="INSTANCE_NAME" GUIDisplayName="Instance Name" GUIInputType="CFG" ScaleFactor="1000" IsDefaultValueSet="Y" DisplayType="String" UseAsMODisplayName="Y" DefaultValue="Disk Space Monitor"/>
      <AppsInput AttrId="210143" UsrAttrId="-6" UniqueName="COLLECTDATA" GUIDisplayName="Collect Data" GUIInputType="CTL" ScaleFactor="1000" IsDefaultValueSet="Y" DisplayType="Boolean" DefaultValue="1"/>
      <AppsInput AttrId="210138" UsrAttrId="-3" UniqueName="SRCIP" GUIDisplayName="Source Agent" GUIInputType="CFG" ScaleFactor="1000" GUIDisplaySequenceNumber="2" MoReferenceType="10000" GUIRequiredOnCreate="N" DisplayType="MOReference"/>
      <AppsInput AttrId="210142" UsrAttrId="-2" UniqueName="CFGPOLLTIMEOUT" GUIDisplayName="Configuration Poll Timeout" GUIInputType="CTL" ScaleFactor="1000" IsDefaultValueSet="Y" DisplayType="Integer" DefaultValue="20"/>
      <AppsInput AttrId="210132" UsrAttrId="3" UniqueName="SCRIPTFILE" GUIDisplayName="Script File to Run" GUIEditable="N" GUIInputType="CFG" ScaleFactor="1000" GUIDisplayable="N" IsDefaultValueSet="Y" GUIInputOnCreate="N" GUIRequiredOnCreate="N" DisplayType="String" DefaultValue="ntdskmon.exe"/>
      <AppsInput AttrId="210141" UsrAttrId="-1" UniqueName="CFGPOLLPERIOD" GUIDisplayName="Configuration Poll Interval" GUIInputType="CTL" ScaleFactor="1000" IsDefaultValueSet="Y" DisplayType="Integer" DefaultValue="86400"/>
      <AppsInput AttrId="210131" UsrAttrId="2" UniqueName="INSTANCE_NAME" GUIDisplayName="Instance Name" GUIInputType="CFG" ScaleFactor="1000" GUIDisplaySequenceNumber="1" IsDefaultValueSet="Y" GUIRequiredOnCreate="N" DisplayType="String" UseAsMODisplayName="Y"/>
      <AppsInput AttrId="210140" UsrAttrId="-5" UniqueName="STSPOLLTIMEOUT" GUIDisplayName="Statistics Poll Timeout" GUIInputType="CTL" ScaleFactor="1000" IsDefaultValueSet="Y" DisplayType="Integer" DefaultValue="20"/>
      <AppsInput AttrId="210139" UsrAttrId="-4" UniqueName="STSPOLLPERIOD" GUIDisplayName="Statistics Poll Interval" GUIInputType="CTL" ScaleFactor="1000" IsDefaultValueSet="Y" DisplayType="Integer" DefaultValue="300"/>
      <AppsInput AttrId="210147" UsrAttrId="993" UniqueName="TARGETIP" GUIDisplayName="Target IP/Host Name" GUIInputType="CFG" ScaleFactor="1000" GUIDisplaySequenceNumber="3" UseAsInstanceName="Y" IsDefaultValueSet="Y" DisplayType="IPAddress" DefaultValue="0"/>
      <AppsInput AttrId="210133" UsrAttrId="4" UniqueName="NO_OF_INPUT_PARAMS" GUIDisplayName="No Of Input Params" GUIEditable="N" GUIInputType="CFG" ScaleFactor="1000" GUIDisplayable="N" IsDefaultValueSet="Y" GUIInputOnCreate="N" GUIRequiredOnCreate="N" DisplayType="Integer" DefaultValue="1"/>
      <AppsInput AttrId="210134" UsrAttrId="5" UniqueName="DIR" GUIDisplayName="Drive" GUIInputType="CFG" ScaleFactor="1000" GUIDisplaySequenceNumber="51" UseAsInstanceName="Y" IsDefaultValueSet="Y" DisplayType="String" GUIHasListOfChoice="Y"/>
      <AppsInput AttrId="21013980" UsrAttrId="980" UniqueName="CI_TOKEN_ID" GUIDisplayName="CI Token ID" GUIInputType="CFG" GUIEditable="N" ScaleFactor="1000" GUIDisplaySequenceNumber="52" IsDefaultValueSet="Y" AttrReferenceType="ANY" GUIRequiredOnCreate="N" IsInputAttribute="Y" DisplayType="String" DefaultValue=""/>
      <AppsInput AttrId="21013981" UsrAttrId="981" UniqueName="CI_ID" GUIDisplayName="CI ID" GUIInputType="CFG" GUIEditable="N" ScaleFactor="1000" GUIDisplaySequenceNumber="53" IsDefaultValueSet="Y" AttrReferenceType="ANY" GUIRequiredOnCreate="N" IsInputAttribute="Y" DisplayType="String" DefaultValue=""/>
      <AppsInput AttrId="21013982" UsrAttrId="982" UniqueName="CI_ALIAS" GUIDisplayName="CI Alias" GUIInputType="CFG" GUIEditable="Y" GUIStringLength="255" ScaleFactor="1000" GUIDisplaySequenceNumber="54" IsDefaultValueSet="Y" AttrReferenceType="ANY" GUIRequiredOnCreate="N" IsInputAttribute="Y" DisplayType="String" DefaultValue=""/>
      <AppsInput AttrId="21013468" UsrAttrId="468" UniqueName="TENANT_ID" GUIDisplayName="Tenant ID" MoReferenceType="0" AttrReferenceType="Unknown" DefaultValue="" ScaleFactor="0" GUIStringLength="255" GUIDisplaySequenceNumber="55" GUIDisplayable="N" DisplayType="String" UseAsMODisplayName="N" GUIInputType="CFG" IsInputAttribute="Y" IsAutoCreated="Y" GUIRequiredOnCreate="N" GUIEditable="N" GUIInputOnCreate="Y" IsDefaultValueSet="N" UseAsInstanceName="N" GUIHasListOfChoice="N" UseNormalDistribution="N"/>
      <AppsConfig AttrId="210146" UsrAttrId="9" UniqueName="PW_MON_VER" GUIDisplayName="Monitor Version" DisplayType="String" ScaleFactor="1000"/>
      <AppsConfig AttrId="210135" UsrAttrId="6" UniqueName="TOTAL_SIZE" GUIDisplayName="Size" DisplayType="String" ScaleFactor="1000"/>
      <AppsStats>
        <CoreAppsStats AttrId="210137" UsrAttrId="8" UniqueName="AVAILABILITY" GUIDisplayName="Availability" TableName="NTFILESYSTEM" ColumnName="AVAILABILITY" ScaleFactor="1000" DisplayType="Integer" UnitOfMeasurement="%" GUIGraphedByDefault="N"/>
      </AppsStats>
      <AppsStats>
        <CoreAppsStats AttrId="210136" UsrAttrId="7" UniqueName="USED_PERCENT" GUIDisplayName="Used" TableName="NTFILESYSTEM" ColumnName="USEDPCT" ScaleFactor="1000" DisplayType="Integer" UnitOfMeasurement="%"/>
      </AppsStats>
      <AppsStats>
        <CoreAppsStats AttrId="2101335" UsrAttrId="35" UniqueName="FREE_DISK_SPACE" GUIDisplayName="Free Disk Space" TableName="NTFILESYSTEM" ColumnName="FREEDSKSPC" ScaleFactor="1000" DisplayType="Integer" UnitOfMeasurement="MB" GUIGraphedByDefault="N"/>
      </AppsStats>
    </Application>
  </Attributes>
</MetaData>
